{
  "meta": {
    "version": "1.0.0",
    "generated_at": "2026-02-05T00:00:00Z",
    "language": "sv",
    "market": "SE"
  },
  "seed": {
    "id": "q.seed",
    "phrase": "privatlån upp till 800 000",
    "x": 0.85,
    "y": 0.85,
    "intent": "transactional",
    "perspective": "provider"
  },
  "nodes": [
    {
      "id": "q.ansok",
      "phrase": "ansök privatlån online",
      "x": 0.88,
      "y": 0.85,
      "cluster_id": "A",
      "intent": "transactional",
      "perspective": "provider",
      "confidence": 0.9,
      "provenance": "ads_api",
      "size": 11,
      "flags": []
    },
    {
      "id": "q.uc",
      "phrase": "privatlån utan UC",
      "x": 0.8,
      "y": 0.78,
      "cluster_id": "A",
      "intent": "transactional",
      "perspective": "provider",
      "confidence": 0.9,
      "provenance": "ads_api",
      "size": 10,
      "flags": []
    },
    {
      "id": "q.snabbt",
      "phrase": "snabbt privatlån 800 000",
      "x": 0.86,
      "y": 0.75,
      "cluster_id": "A",
      "intent": "transactional",
      "perspective": "provider",
      "confidence": 0.9,
      "provenance": "serp_related",
      "size": 9,
      "flags": []
    },
    {
      "id": "q.utan_sakerhet",
      "phrase": "låna 800 000 utan säkerhet",
      "x": 0.9,
      "y": 0.72,
      "cluster_id": "A",
      "intent": "transactional",
      "perspective": "provider",
      "confidence": 0.9,
      "provenance": "ads_api",
      "size": 9,
      "flags": []
    },
    {
      "id": "q.lag_ranta",
      "phrase": "privatlån låg ränta",
      "x": 0.82,
      "y": 0.82,
      "cluster_id": "A",
      "intent": "transactional",
      "perspective": "provider",
      "confidence": 0.9,
      "provenance": "ads_api",
      "size": 10,
      "flags": []
    },
    {
      "id": "q.jamfor",
      "phrase": "jämför privatlån",
      "x": 0.55,
      "y": 0.48,
      "cluster_id": "B",
      "intent": "commercial",
      "perspective": "advisor",
      "confidence": 0.88,
      "provenance": "ads_api",
      "size": 12,
      "flags": []
    },
    {
      "id": "q.basta",
      "phrase": "bästa privatlånet 2025",
      "x": 0.6,
      "y": 0.52,
      "cluster_id": "B",
      "intent": "commercial",
      "perspective": "advisor",
      "confidence": 0.9,
      "provenance": "autocomplete",
      "size": 11,
      "flags": []
    },
    {
      "id": "q.ranta_jamf",
      "phrase": "privatlån ränta jämförelse",
      "x": 0.56,
      "y": 0.56,
      "cluster_id": "B",
      "intent": "commercial",
      "perspective": "advisor",
      "confidence": 0.86,
      "provenance": "serp_paa",
      "size": 9,
      "flags": []
    },
    {
      "id": "q.betala_av",
      "phrase": "betala av privatlån 800 000",
      "x": 0.68,
      "y": 0.25,
      "cluster_id": "C",
      "intent": "informational",
      "perspective": "seeker",
      "confidence": 0.55,
      "provenance": "serp_paa",
      "size": 12,
      "flags": [
        "⚠ wrong_cluster_for_anchor"
      ]
    },
    {
      "id": "q.amortera",
      "phrase": "amortera privatlån snabbare",
      "x": 0.62,
      "y": 0.2,
      "cluster_id": "C",
      "intent": "howto",
      "perspective": "seeker",
      "confidence": 0.5,
      "provenance": "serp_related",
      "size": 10,
      "flags": [
        "⚠ wrong_cluster_for_anchor"
      ]
    },
    {
      "id": "q.avbetal",
      "phrase": "privatlån avbetalningsplan",
      "x": 0.7,
      "y": 0.3,
      "cluster_id": "C",
      "intent": "informational",
      "perspective": "seeker",
      "confidence": 0.6,
      "provenance": "ads_api",
      "size": 9,
      "flags": []
    },
    {
      "id": "q.hur_mkt",
      "phrase": "hur mycket kan jag låna",
      "x": 0.3,
      "y": 0.28,
      "cluster_id": "D",
      "intent": "informational",
      "perspective": "seeker",
      "confidence": 0.7,
      "provenance": "ads_api",
      "size": 11,
      "flags": []
    },
    {
      "id": "q.kvar",
      "phrase": "kvar att leva på efter lån",
      "x": 0.22,
      "y": 0.22,
      "cluster_id": "D",
      "intent": "informational",
      "perspective": "seeker",
      "confidence": 0.44999999999999996,
      "provenance": "llm_inferred",
      "size": 9,
      "flags": []
    },
    {
      "id": "q.lagen",
      "phrase": "konsumentkreditlagen privatlån",
      "x": 0.24,
      "y": 0.56,
      "cluster_id": "E",
      "intent": "informational",
      "perspective": "regulator",
      "confidence": 0.55,
      "provenance": "serp_top_urls",
      "size": 9,
      "flags": []
    },
    {
      "id": "q.rantetak",
      "phrase": "räntetak privatlån Sverige",
      "x": 0.3,
      "y": 0.62,
      "cluster_id": "E",
      "intent": "informational",
      "perspective": "regulator",
      "confidence": 0.6,
      "provenance": "serp_top_urls",
      "size": 8,
      "flags": []
    }
  ],
  "edges": [
    {
      "from": "q.seed",
      "to": "q.ansok",
      "strength": 0.92,
      "types": [
        "serp_overlap"
      ],
      "synapse_card": {
        "from_id": "q.seed",
        "to_id": "q.ansok",
        "strength": 0.92,
        "types": [
          "serp_overlap"
        ],
        "direction": "bidirectional",
        "intent_shift": "",
        "perspective_shift": "",
        "confidence": 0.9,
        "bridge_statement": "Direkt relaterat erbjudande/valsteg.",
        "evidence": [
          {
            "source": "serp_top_urls",
            "kind": "mixed",
            "summary": "SERP overlap proxy + intent/perspective alignment",
            "confidence": 0.9
          }
        ]
      }
    },
    {
      "from": "q.seed",
      "to": "q.uc",
      "strength": 0.85,
      "types": [
        "serp_overlap"
      ],
      "synapse_card": {
        "from_id": "q.seed",
        "to_id": "q.uc",
        "strength": 0.85,
        "types": [
          "serp_overlap"
        ],
        "direction": "bidirectional",
        "intent_shift": "",
        "perspective_shift": "",
        "confidence": 0.85,
        "bridge_statement": "Direkt relaterat erbjudande/valsteg.",
        "evidence": [
          {
            "source": "serp_top_urls",
            "kind": "mixed",
            "summary": "SERP overlap proxy + intent/perspective alignment",
            "confidence": 0.85
          }
        ]
      }
    },
    {
      "from": "q.seed",
      "to": "q.snabbt",
      "strength": 0.88,
      "types": [
        "serp_overlap"
      ],
      "synapse_card": {
        "from_id": "q.seed",
        "to_id": "q.snabbt",
        "strength": 0.88,
        "types": [
          "serp_overlap"
        ],
        "direction": "bidirectional",
        "intent_shift": "",
        "perspective_shift": "",
        "confidence": 0.88,
        "bridge_statement": "Direkt relaterat erbjudande/valsteg.",
        "evidence": [
          {
            "source": "serp_top_urls",
            "kind": "mixed",
            "summary": "SERP overlap proxy + intent/perspective alignment",
            "confidence": 0.88
          }
        ]
      }
    },
    {
      "from": "q.seed",
      "to": "q.utan_sakerhet",
      "strength": 0.83,
      "types": [
        "serp_overlap"
      ],
      "synapse_card": {
        "from_id": "q.seed",
        "to_id": "q.utan_sakerhet",
        "strength": 0.83,
        "types": [
          "serp_overlap"
        ],
        "direction": "bidirectional",
        "intent_shift": "",
        "perspective_shift": "",
        "confidence": 0.83,
        "bridge_statement": "Direkt relaterat erbjudande/valsteg.",
        "evidence": [
          {
            "source": "serp_top_urls",
            "kind": "mixed",
            "summary": "SERP overlap proxy + intent/perspective alignment",
            "confidence": 0.83
          }
        ]
      }
    },
    {
      "from": "q.seed",
      "to": "q.lag_ranta",
      "strength": 0.86,
      "types": [
        "serp_overlap"
      ],
      "synapse_card": {
        "from_id": "q.seed",
        "to_id": "q.lag_ranta",
        "strength": 0.86,
        "types": [
          "serp_overlap"
        ],
        "direction": "bidirectional",
        "intent_shift": "",
        "perspective_shift": "",
        "confidence": 0.86,
        "bridge_statement": "Direkt relaterat erbjudande/valsteg.",
        "evidence": [
          {
            "source": "serp_top_urls",
            "kind": "mixed",
            "summary": "SERP overlap proxy + intent/perspective alignment",
            "confidence": 0.86
          }
        ]
      }
    },
    {
      "from": "q.seed",
      "to": "q.jamfor",
      "strength": 0.78,
      "types": [
        "serp_overlap"
      ],
      "synapse_card": {
        "from_id": "q.seed",
        "to_id": "q.jamfor",
        "strength": 0.78,
        "types": [
          "serp_overlap"
        ],
        "direction": "bidirectional",
        "intent_shift": "",
        "perspective_shift": "",
        "confidence": 0.78,
        "bridge_statement": "Direkt relaterat erbjudande/valsteg.",
        "evidence": [
          {
            "source": "serp_top_urls",
            "kind": "mixed",
            "summary": "SERP overlap proxy + intent/perspective alignment",
            "confidence": 0.78
          }
        ]
      }
    },
    {
      "from": "q.seed",
      "to": "q.basta",
      "strength": 0.8,
      "types": [
        "serp_overlap"
      ],
      "synapse_card": {
        "from_id": "q.seed",
        "to_id": "q.basta",
        "strength": 0.8,
        "types": [
          "serp_overlap"
        ],
        "direction": "bidirectional",
        "intent_shift": "",
        "perspective_shift": "",
        "confidence": 0.8,
        "bridge_statement": "Direkt relaterat erbjudande/valsteg.",
        "evidence": [
          {
            "source": "serp_top_urls",
            "kind": "mixed",
            "summary": "SERP overlap proxy + intent/perspective alignment",
            "confidence": 0.8